,song_url,song_names,artist,songtext
11,https://www.lyrics.com/lyric-lf/1658296/Pashanim/Homicides,Homicides,Pashanim,"Yeah

Ich mach' einen Homicide, noch heute Nacht (pew, pew, pew)
Gang-Shit mit RB am Block um halb acht (aha, aha)
Exen mit Chapo, sind strapped in der Stadt (ja)
Pasha ist kafa, seit zwei Tagen wach (pew, pew, pew)
Ich mach' einen Homicide, noch heute Nacht (uh)
Gang-Shit mit RB am Block um halb acht (aha, aha)
Exen mit Chapo, sind strapped in der Stadt (pew, pew, pew)
Pasha ist kafa, seit zwei Tagen wach (yeah)

Ich treff' RB, Lipschitzallee
Zwei Dinger drück' ich noch weg, auf dem Weg
Augen sind grün, Sweater ist schwarz
All meine Billies drücken Packs weg im Park
Paper ist yellow, Cano-Castello
Mit sechzehn Jahren sind wir savage wie Fredo
Du willst Protection wie Massive Attack
Pasha nimmt dir deine Vapormax weg
Ich trapp' von Kotti bis Bergmann nachts
Du wachst auf ohne Schuhe, direkt Hermannplatz
Ich trapp' zu Shoreline, zu Valee und Yung Bans
Du bist auf Partys und sagst, dass du Can kennst
Rapp' nicht in der Booth, ich nehm' auf im Traphaus
Für dich ist sie wavey, für mich sieht sie lesh aus
Vercheck' Bread and Butter, Tilidin
An den Sohn von Thilo Sarrazin

Ich mach' einen Homicide, noch heute Nacht (pew, pew, pew)
Gang-Shit mit RB am Block um halb acht (aha, aha)
Exen mit Chapo, sind strapped in der Stadt (ja)
Pasha ist kafa, seit zwei Tagen wach (pew, pew, pew)
Ich mach' einen Homicide, noch heute Nacht (uh)
Gang-Shit mit RB am Block um halb acht (aha, aha)
Exen mit Chapo, sind strapped in der Stadt (pew, pew, pew)
Pasha ist kafa, seit zwei Tagen wach

Pasha mit Saka und Jascha mit Taş
Mieses Massaker, verklagt wird die Nacht
Locker 'nen Achter, der TAC dünnt dich ab
Master-Kush, kafa, das Laster macht schwach
Siehst du die Jungs? Lungen gebumst
Trapper macht Faxen und ihr nennt das Kunst
Immer auf Achse, belastender Sumpf
Ich lager' den Batzen im Adidas-Strumpf
Ich bin per du mit Dealern und Junkies
Mehringdamm Treffpunkt, wenn Can dir einen Gramm gibt
Lass' mir nichts ansehen, was für verhandeln?
Asbach Uralt in der N26
Ficke die zwölf, nix in den Taschen
Perso-Kontrolle und dann auf die Wache
Halte meinen Mund, was wollen sie machen?
Standard-Verfahren und dann werd' ich entlassen

Ich mach' einen Homicide, noch heute Nacht (pew, pew, pew)
Gang-Shit mit RB am Block um halb acht (aha, aha)
Exen mit Chapo, sind strapped in der Stadt (ja)
Pasha ist kafa, seit zwei Tagen wach (pew, pew, pew)
Ich mach' einen Homicide, noch heute Nacht (uh)
Gang-Shit mit RB am Block um halb acht (aha, aha)
Exen mit Chapo, sind strapped in der Stadt (pew, pew, pew)
Pasha ist kafa, seit zwei Tagen wach"
12,https://www.lyrics.com/lyric/37923846/Pashanim/junge+ceos,junge ceos,Pashanim,"Ey, ja (okay, nochmal von vorne)
Ey, ja (Pasha, 61)
Ja, ey (Gang)
Ey, ey, ah (Yeah, Kevin made this beat, bih)

Junge Kunden, junge CEOs, ey
Junge Türken in mein' Videos, ey
Junges Geld in den Tasche
Junge Straps, junge Waffen
Deine Gang ist zum Lachen

Wir sind big mittlerweile, aber ich weiß noch ganz genau
Du setzt noch mal hundert drauf, wenn RB dir nicht vertraut
Ah, yeah, und sie sieht mein' Flow
Ah, yeah, ey, ey

Bin nicht mit dir, weil du sus bist
Ich und mein Group auf f*ck Shit
Mein Plug und ich, wir sind eng-eng
Selbe Party, selbe Gang-Gang
Yeah, yeah, nenn' Money „Schatz“, ey
Rb tickt Drugs, ey, ah

Guck, ich hab' acht Dinger an mein' Eiern
Fick Polizei in Bayern
Guck sie haben RB gecatched, ja
Sieben, doch ohne Schmuck sechs, ja

Ey, ey, Sportback boys, fahren mies schnell
Ey, ey, verkauf mein SIM für viel Geld
Smoke in Paris 
In mein Tasche hundert G's
100 Bricks, fahr' sie rum
Kreuzberg Haze, rauch' mich dumm

Junge Kunden, junge CEOs, ey
Junge Türken in mein' Videos, ey
Junges Geld in den Tasche
Junge Straps, junge Waffen
Deine Gang ist zum Lachen

Junge Kunden, junge CEOs, ey
Junge Türken in mein' Videos, ey
Junges Geld in den Tasche
Junge Straps, junge Waffen
Deine Gang ist zum Lachen
Ey, ey"
13,https://www.lyrics.com/lyric/36753961/Pashanim/Shababs+botten,Shababs botten,Pashanim,"Ey (K-K-Kingsake)
Ey, Pasha, ey, ja, ey (YungGlizzy)

Shababs botten, grüne Augen, braune Locken
Tn's rocken, halbe Kiste, wenn wir shoppen
Shababs botten, grüne Augen, braune Locken
Tn's rocken, halbe Kiste, wenn wir shoppen

Prada Çanta voller Haze
Komplett Kafa, outta Race
Braune Locken, grüne Augen
Shababs sind am Botten, no face, no case, ey
Halbe Kiste im Toyota gebunkert
Einundsechzig, keiner sober, nur Kundschaft
Neue Ringe, neue Eyes
Einundsechzig, gerade heiß
Shawty, sag' mir, wie du heißt
Hab' vergessen, tut mir leid
An Sarrazin will ich verdienen, bin in Berlin
Sein Sohn holt jede Woche Tilidin
Mehringdamm, Saka-Wasser oder Lean
Müsteris schreiben mir: „Komm' vorbei“ 
Und alle paar Monate flieg' ich Türkei
Ich ess' einen Adana oder auch zwei
Abi hat Katana an seinem Bein und

Shababs botten, grüne Augen, braune Locken
Tn's rocken, halbe Kiste, wenn wir shoppen
Shababs botten, grüne Augen, braune Locken
Tn's rocken, halbe Kiste, wenn wir shoppen
Shababs botten, grüne Augen, braune Locken
Tn's rocken, halbe Kiste, wenn wir shoppen
Shababs botten, grüne Augen, braune Locken
Tn's rocken, halbe Kiste, wenn wir shoppen"
14,https://www.lyrics.com/lyric-lf/6585417/Pashanim/paris+freestyle+-+skrilla+remix,paris freestyle - skrilla remix,Pashanim,"Ja, Pasha, ey
Paris-Freestyle-Skrilla-Remix
Ey

Drei Tage draußen, Paris und ich hab' dreißig auf mir right now
Pushe Packs, rauche Haze und das weißt du auch ganz genau
Ich lauf', ich trapp' und ich trag' mein Gavaz durch die Innenstadt
Ich bin eng, eng mit mein' Bruder und mein Bruder ist mein Plug
Ich fahr' Cayenne und rauch' einen riesen Joint am Donnerstag um acht
Ta7os wussten ganze Zeit, wo ich bin und was ich mach'
Ja, ich spinn' und dreh' die Stadt, ja, ich kauf' und pack' es ab
Ja, ich lauf' mit großer Tasche voller Gavaz, Adidas
Ja, ich hätt' dir das erzählt, aber wir hatten kein' Kontakt
Und die Amcas nerven mies, weil sie beschatten meinen Shabab
Und ich mach' so viele Bands in ein' Quartal wie du im Jahr
Und wahrscheinlich auch noch mehr, wenn wir ehrlich sind, ah-ha
Ich hör' Tay K, „Lemonade“ und trink' ein Lipton (ein Lipton)
Und ich würde mich und deine Freundin bisschen shippen
Ja, ich bin 6-1er und sie hängen mir an den Lippen
Und immer wenn ich Lean im Cup hab', muss ich was verschütten
Ja, ich spill' den halben Becher und ich glaub', ich bin RB
Und ich wünsch' mir Gucci, Prada, Givenchy und THC
Deutsche Rapper wollen nur Clout, wenn sie meinen Namen jetzt erwähnen
Ja, mir wurd' davon erzählt
Für mich ist das kein Problem
Trink' einen Çay bei mein' Friseur und ich trag' Polo, Ralph Lauren
Fühl' mich wie 2008
Oder auch 2010
Und ich war paar Tage Wien, aber jetzt bin ich Paris
Und dann morgen nach Berlin und dann wieder in die Streets
Ah, Gang"
